{
  "actor_id": "human-1",
  "decision": "hold",
  "exceptions": [],
  "issued_at": "2026-08-08T00:00:00Z",
  "observation_refs": [],
  "ordered_attempt_ids": [],
  "promotion_id": "promotion-1",
  "schema_version": 1,
  "source_event_id": "event-1",
  "test_manifest_digest": "sha256:0000000000000000000000000000000000000000000000000000000000000000",
  "threshold_results": {}
}
